textOriginal,word,normalisasi
membuat ulang youtube rewind indonesia tidak suara,membuat
bang eka gustiwana mohon buat campur lagu bad blood campur sambalado itu bagus banget,eka
bimo picky pikcs mana oi,picky
bimo picky pikcs mana oi,pikcs
oh my god trending dong hari juta viewers keren banget,god
apa cuma gue kira kira han yora mirip ci panda last day production,last
andai reviewer gadget kek sobat telepon gadgetin dan kawan kawan,gadgetin
youtube rewind indonesia games yudist gaming miaw aug day helder hi patrick gogogoy sonalibaba jeje adriel zenmatho erpan beaconcream the dream craft,games
coki muslim was so lit,coki
gleen julifer vanessa  sevilla daddy cobucervgen halilintar erpan yudist young lex,sevilla
muka wika salim alim,wika
ericko lim afif miau aug dimana,miau
gempak sial paling mantap part pertahankan tupeh gila la boi selamat tahun baru warga indonesia,tupeh
kesini ngomong ngomong liat brian furan kecewa,ngomong
bang  yudha zenmatho dan erpan,yudha
pas mobil jess no limit datang langsung gue tau jess no limit,no
youtube rewind indonesia director agung hapsah musik producer eka gustiwana gustiwana editor timeone story arief muhammad visual effect oki jodi setuju,timeone
youtube rewind indonesia director agung hapsah musik producer eka gustiwana gustiwana editor timeone story arief muhammad visual effect oki jodi setuju,story
youtube rewind indonesia director agung hapsah musik producer eka gustiwana gustiwana editor timeone story arief muhammad visual effect oki jodi setuju,jodi
youtube rewind indonesia director agung hapsah musik producer eka gustiwana gustiwana editor timeone story arief muhammad visual effect oki jodi setuju,setuju
acctually the videos okay but why they must picked english songs they have their own songsright youtube rewind original are lebuh bagus than thisjust comentdont roast me by reply it,acctually
acctually the videos okay but why they must picked english songs they have their own songsright youtube rewind original are lebuh bagus than thisjust comentdont roast me by reply it,okay
acctually the videos okay but why they must picked english songs they have their own songsright youtube rewind original are lebuh bagus than thisjust comentdont roast me by reply it,but
kok mau liat dibalik layar channel reza tidak ya,dibalik
wait ini was years ago damn,ago
bayangkan ericko lim dylan pros vs chandra liow reza arap apa akan be datang,bayangkan
emang miaw gregi,gregi
miaw gregy prabowo mana tidak ikut,gregy
bang irvan erpan datang dong,irvan
bila memang berpisah aku tetap setia lagu bagus hidup aku,berpisah
absolutely beautiful,absolutely
anjir kaido jatuh dong sekali pukul lufy chapter ini lengkap banget dah tonton jangan lupa subscribe like dam komentar,kaido
thank you for al the content creator youtuber for give us the thing during the pandemic good bles you all,all
aku bangga liat pround youtuber indonesia,pround
sumpah merinding gua toton best lah,toton
hobi makan hirotada radifanjes tidak limit sisca youtuber keluarga masukin tahun kakak,sisca
keren setelah tapi gara liat ini tiap dengar lagu bad blood langsung spontan nyamber sambala sambala bala sambalado,setelah
terima kasih buat youtube rewind kalian luar bisa balik semua kekurangan ini keren,kekurangan
keren habis karya berkelas indonesia semangat rukun damai,berkelas
waduh buset serepet bagus tetapi gila,serepet
speachles this ini beautiful,speachles
speachles this ini beautiful,this
keren banget nangis,nangis
gokil trending congrats al teams,teams
gila bosan bosan tonton terima kasih ericko lim atas inisiatif tingkatkan kawan peace,tingkatkan
youtuber indonesia lagu nya pakai bahasa inggis seharusnya lagu nya pakai bahasa indonesia orang inggris aja pakai bahasa nya sendiri,inggis
youtuber indonesia lagu nya pakai bahasa inggis seharusnya lagu nya pakai bahasa indonesia orang inggris aja pakai bahasa nya sendiri,seharusnya
nesi judge kurus anjir,nesi
ashiap santai,ashiap
kok gojogo goyang  kagak,gojogo
bobon santoso mana anjing idola aku mabok heula atuh,mabok
tidak ngerti,ngerti
bang kali kali dong bang ke mekah duit abang banyak ye bang,mekah
tidak chandra liow miaw aug motomobi qorygore edho zel tanboykun awkarin eka gustiwana masih banyak youtuber gede tidak,motomobi
tidak chandra liow miaw aug motomobi qorygore edho zel tanboykun awkarin eka gustiwana masih banyak youtuber gede tidak,tanboykun
be your ngentot and never surrend ngentot,surrend
mad respect to everyone being involved god bless us al,bless
jujur sasu bilang anjing anjing banget tidibang tidibang tidibang tidak hahaha,sasu
tidak ramai kurang trending ini cuma sekdit banget,sekdit,sedikit
orang tidak suka video ini berarti orang iri tidak cinta tanah air,berarti
